[
  {
    "id": "NAV-001",
    "from_screen": "SCR-START",
    "to_screen": "SCR-SETUP",
    "event": "new_run",
    "guard": "always",
    "mutates_financial_state": false,
    "time_cost_days": 0,
    "state": "DESIGN",
    "implemented": true,
    "evidence_level": "BERLIN_DESIGN_NOT_C64",
    "test_id": "TST-NAV-GRAPH",
    "implementation": "V0.6",
    "side_effect_policy": "NONE"
  },
  {
    "id": "NAV-002",
    "from_screen": "SCR-SETUP",
    "to_screen": "SCR-HQ",
    "event": "confirmed_new_run",
    "guard": "setup_valid",
    "mutates_financial_state": true,
    "time_cost_days": 0,
    "state": "DESIGN",
    "implemented": true,
    "evidence_level": "BERLIN_DESIGN_NOT_C64",
    "test_id": "TST-NAV-GRAPH",
    "implementation": "V0.6",
    "side_effect_policy": "COMMAND_ONLY"
  },
  {
    "id": "NAV-003",
    "from_screen": "SCR-HQ",
    "to_screen": "SCR-START",
    "event": "archive_run",
    "guard": "user_confirmed",
    "mutates_financial_state": true,
    "time_cost_days": 0,
    "state": "DESIGN",
    "implemented": false,
    "evidence_level": "BERLIN_DESIGN_NOT_C64",
    "test_id": "TST-NAV-GRAPH",
    "implementation": "PLANNED",
    "side_effect_policy": "COMMAND_ONLY"
  },
  {
    "id": "NAV-004",
    "from_screen": "SCR-HQ",
    "to_screen": "SCR-MAP",
    "event": "open",
    "guard": "always",
    "mutates_financial_state": false,
    "time_cost_days": 0,
    "state": "DESIGN",
    "implemented": true,
    "evidence_level": "BERLIN_DESIGN_NOT_C64",
    "test_id": "TST-NAV-GRAPH",
    "implementation": "V0.6",
    "side_effect_policy": "NONE"
  },
  {
    "id": "NAV-005",
    "from_screen": "SCR-MAP",
    "to_screen": "SCR-HQ",
    "event": "close",
    "guard": "always",
    "mutates_financial_state": false,
    "time_cost_days": 0,
    "state": "DESIGN",
    "implemented": true,
    "evidence_level": "BERLIN_DESIGN_NOT_C64",
    "test_id": "TST-NAV-GRAPH",
    "implementation": "V0.6",
    "side_effect_policy": "NONE"
  },
  {
    "id": "NAV-006",
    "from_screen": "SCR-HQ",
    "to_screen": "SCR-MARKET",
    "event": "open",
    "guard": "always",
    "mutates_financial_state": false,
    "time_cost_days": 0,
    "state": "DESIGN",
    "implemented": true,
    "evidence_level": "BERLIN_DESIGN_NOT_C64",
    "test_id": "TST-NAV-GRAPH",
    "implementation": "V0.6",
    "side_effect_policy": "NONE"
  },
  {
    "id": "NAV-007",
    "from_screen": "SCR-MARKET",
    "to_screen": "SCR-HQ",
    "event": "close",
    "guard": "always",
    "mutates_financial_state": false,
    "time_cost_days": 0,
    "state": "DESIGN",
    "implemented": true,
    "evidence_level": "BERLIN_DESIGN_NOT_C64",
    "test_id": "TST-NAV-GRAPH",
    "implementation": "V0.6",
    "side_effect_policy": "NONE"
  },
  {
    "id": "NAV-008",
    "from_screen": "SCR-HQ",
    "to_screen": "SCR-CONTRACTS",
    "event": "open",
    "guard": "always",
    "mutates_financial_state": false,
    "time_cost_days": 0,
    "state": "DESIGN",
    "implemented": false,
    "evidence_level": "BERLIN_DESIGN_NOT_C64",
    "test_id": "TST-NAV-GRAPH",
    "implementation": "PLANNED",
    "side_effect_policy": "NONE"
  },
  {
    "id": "NAV-009",
    "from_screen": "SCR-CONTRACTS",
    "to_screen": "SCR-HQ",
    "event": "close",
    "guard": "always",
    "mutates_financial_state": false,
    "time_cost_days": 0,
    "state": "DESIGN",
    "implemented": false,
    "evidence_level": "BERLIN_DESIGN_NOT_C64",
    "test_id": "TST-NAV-GRAPH",
    "implementation": "PLANNED",
    "side_effect_policy": "NONE"
  },
  {
    "id": "NAV-010",
    "from_screen": "SCR-HQ",
    "to_screen": "SCR-STOCK",
    "event": "open",
    "guard": "always",
    "mutates_financial_state": false,
    "time_cost_days": 0,
    "state": "DESIGN",
    "implemented": true,
    "evidence_level": "BERLIN_DESIGN_NOT_C64",
    "test_id": "TST-NAV-GRAPH",
    "implementation": "V0.6",
    "side_effect_policy": "NONE"
  },
  {
    "id": "NAV-011",
    "from_screen": "SCR-STOCK",
    "to_screen": "SCR-HQ",
    "event": "close",
    "guard": "always",
    "mutates_financial_state": false,
    "time_cost_days": 0,
    "state": "DESIGN",
    "implemented": true,
    "evidence_level": "BERLIN_DESIGN_NOT_C64",
    "test_id": "TST-NAV-GRAPH",
    "implementation": "V0.6",
    "side_effect_policy": "NONE"
  },
  {
    "id": "NAV-012",
    "from_screen": "SCR-HQ",
    "to_screen": "SCR-INBOX",
    "event": "open",
    "guard": "always",
    "mutates_financial_state": false,
    "time_cost_days": 0,
    "state": "DESIGN",
    "implemented": false,
    "evidence_level": "BERLIN_DESIGN_NOT_C64",
    "test_id": "TST-NAV-GRAPH",
    "implementation": "PLANNED",
    "side_effect_policy": "NONE"
  },
  {
    "id": "NAV-013",
    "from_screen": "SCR-INBOX",
    "to_screen": "SCR-HQ",
    "event": "close",
    "guard": "always",
    "mutates_financial_state": false,
    "time_cost_days": 0,
    "state": "DESIGN",
    "implemented": false,
    "evidence_level": "BERLIN_DESIGN_NOT_C64",
    "test_id": "TST-NAV-GRAPH",
    "implementation": "PLANNED",
    "side_effect_policy": "NONE"
  },
  {
    "id": "NAV-014",
    "from_screen": "SCR-HQ",
    "to_screen": "SCR-COMPETITORS",
    "event": "open",
    "guard": "always",
    "mutates_financial_state": false,
    "time_cost_days": 0,
    "state": "DESIGN",
    "implemented": false,
    "evidence_level": "BERLIN_DESIGN_NOT_C64",
    "test_id": "TST-NAV-GRAPH",
    "implementation": "PLANNED",
    "side_effect_policy": "NONE"
  },
  {
    "id": "NAV-015",
    "from_screen": "SCR-COMPETITORS",
    "to_screen": "SCR-HQ",
    "event": "close",
    "guard": "always",
    "mutates_financial_state": false,
    "time_cost_days": 0,
    "state": "DESIGN",
    "implemented": false,
    "evidence_level": "BERLIN_DESIGN_NOT_C64",
    "test_id": "TST-NAV-GRAPH",
    "implementation": "PLANNED",
    "side_effect_policy": "NONE"
  },
  {
    "id": "NAV-016",
    "from_screen": "SCR-HQ",
    "to_screen": "SCR-FINANCE",
    "event": "open",
    "guard": "always",
    "mutates_financial_state": false,
    "time_cost_days": 0,
    "state": "DESIGN",
    "implemented": true,
    "evidence_level": "BERLIN_DESIGN_NOT_C64",
    "test_id": "TST-NAV-GRAPH",
    "implementation": "V0.6",
    "side_effect_policy": "NONE"
  },
  {
    "id": "NAV-017",
    "from_screen": "SCR-FINANCE",
    "to_screen": "SCR-HQ",
    "event": "close",
    "guard": "always",
    "mutates_financial_state": false,
    "time_cost_days": 0,
    "state": "DESIGN",
    "implemented": true,
    "evidence_level": "BERLIN_DESIGN_NOT_C64",
    "test_id": "TST-NAV-GRAPH",
    "implementation": "V0.6",
    "side_effect_policy": "NONE"
  },
  {
    "id": "NAV-018",
    "from_screen": "SCR-HQ",
    "to_screen": "SCR-REPORTS",
    "event": "open",
    "guard": "always",
    "mutates_financial_state": false,
    "time_cost_days": 0,
    "state": "DESIGN",
    "implemented": false,
    "evidence_level": "BERLIN_DESIGN_NOT_C64",
    "test_id": "TST-NAV-GRAPH",
    "implementation": "PLANNED",
    "side_effect_policy": "NONE"
  },
  {
    "id": "NAV-019",
    "from_screen": "SCR-REPORTS",
    "to_screen": "SCR-HQ",
    "event": "close",
    "guard": "always",
    "mutates_financial_state": false,
    "time_cost_days": 0,
    "state": "DESIGN",
    "implemented": false,
    "evidence_level": "BERLIN_DESIGN_NOT_C64",
    "test_id": "TST-NAV-GRAPH",
    "implementation": "PLANNED",
    "side_effect_policy": "NONE"
  },
  {
    "id": "NAV-020",
    "from_screen": "SCR-HQ",
    "to_screen": "SCR-MILESTONES",
    "event": "open",
    "guard": "always",
    "mutates_financial_state": false,
    "time_cost_days": 0,
    "state": "DESIGN",
    "implemented": true,
    "evidence_level": "BERLIN_DESIGN_NOT_C64",
    "test_id": "TST-NAV-GRAPH",
    "implementation": "V0.6",
    "side_effect_policy": "NONE"
  },
  {
    "id": "NAV-021",
    "from_screen": "SCR-MILESTONES",
    "to_screen": "SCR-HQ",
    "event": "close",
    "guard": "always",
    "mutates_financial_state": false,
    "time_cost_days": 0,
    "state": "DESIGN",
    "implemented": true,
    "evidence_level": "BERLIN_DESIGN_NOT_C64",
    "test_id": "TST-NAV-GRAPH",
    "implementation": "V0.6",
    "side_effect_policy": "NONE"
  },
  {
    "id": "NAV-022",
    "from_screen": "SCR-HQ",
    "to_screen": "SCR-JOURNAL",
    "event": "open",
    "guard": "always",
    "mutates_financial_state": false,
    "time_cost_days": 0,
    "state": "DESIGN",
    "implemented": true,
    "evidence_level": "BERLIN_DESIGN_NOT_C64",
    "test_id": "TST-NAV-GRAPH",
    "implementation": "V0.6",
    "side_effect_policy": "NONE"
  },
  {
    "id": "NAV-023",
    "from_screen": "SCR-JOURNAL",
    "to_screen": "SCR-HQ",
    "event": "close",
    "guard": "always",
    "mutates_financial_state": false,
    "time_cost_days": 0,
    "state": "DESIGN",
    "implemented": true,
    "evidence_level": "BERLIN_DESIGN_NOT_C64",
    "test_id": "TST-NAV-GRAPH",
    "implementation": "V0.6",
    "side_effect_policy": "NONE"
  },
  {
    "id": "NAV-024",
    "from_screen": "SCR-HQ",
    "to_screen": "SCR-SAVE",
    "event": "open",
    "guard": "always",
    "mutates_financial_state": false,
    "time_cost_days": 0,
    "state": "DESIGN",
    "implemented": false,
    "evidence_level": "BERLIN_DESIGN_NOT_C64",
    "test_id": "TST-NAV-GRAPH",
    "implementation": "PLANNED",
    "side_effect_policy": "NONE"
  },
  {
    "id": "NAV-025",
    "from_screen": "SCR-SAVE",
    "to_screen": "SCR-HQ",
    "event": "close",
    "guard": "always",
    "mutates_financial_state": false,
    "time_cost_days": 0,
    "state": "DESIGN",
    "implemented": false,
    "evidence_level": "BERLIN_DESIGN_NOT_C64",
    "test_id": "TST-NAV-GRAPH",
    "implementation": "PLANNED",
    "side_effect_policy": "NONE"
  },
  {
    "id": "NAV-026",
    "from_screen": "SCR-HQ",
    "to_screen": "SCR-HELP",
    "event": "open",
    "guard": "always",
    "mutates_financial_state": false,
    "time_cost_days": 0,